DOI,Title,Authors,Abstract,Section,Date
https://doi.org/10.48550/arXiv.2503.17662,Enhancing Persona Consistency for LLMs' Role-Playing using Persona-Aware Contrastive Learning,"Ke Ji, Yixin Lian, Linxu Li, Jingsheng Gao, Weiyuan Li, Bin Dai","In recent years, large language models (LLMs) have achieved breakthrough progress in many dialogue generation tasks. However, their lack of emotion and fine-grained role awareness limits the model's ability to provide personalized and diverse interactions further. Current methods face high costs in collecting high-quality annotated data for scenarios such as role-playing, and traditional human alignment methods are difficult to deploy due to the inherent diversity of model behavior in role-playing scenarios. Inspired by the alignment of models for safety behaviors through RLHF (Reinforcement Learning from Human Feedback), in this paper, we revisit model role-playing behavior from the perspective of persona alignment and propose a novel annotation-free framework named \textbf{\underline{P}}ersona-Aware \textbf{\underline{C}}ontrastive \textbf{\underline{L}}earning (PCL) to align LLMs' behavior during role-playing, enhancing the model's role consistency. Specifically, we first design a role chain method to encourage the model to self-question based on the role characteristics and dialogue context to adjust personality consistency. Then, we further enhance the model's role-playing strategy through iterative contrastive learning between the use of role characteristics and not. Experiments on both black-box and white-box LLMs show that LLMs equipped with PCL significantly outperform vanilla LLMs under automatic evaluation methods (CharEval \& GPT-4) and human expert evaluation.",CL,22 Mar 2025
https://doi.org/10.48550/arXiv.2503.17599,GPBench: A Comprehensive and Fine-Grained Benchmark for Evaluating Large Language Models as General Practitioners,"Zheqing Li, Yiying Yang, Jiping Lang, Wenhao Jiang, Yuhang Zhao, Shuang Li, Dingqian Wang, Zhu Lin, Xuanna Li, Yuze Tang, Jiexian Qiu, Xiaolin Lu, Hongji Yu, Shuang Chen, Yuhua Bi, Xiaofei Zeng, Yixian Chen, Junrong Chen, Lin Yao","General practitioners (GPs) serve as the cornerstone of primary healthcare systems by providing continuous and comprehensive medical services. However, due to community-oriented nature of their practice, uneven training and resource gaps, the clinical proficiency among GPs can vary significantly across regions and healthcare settings. Currently, Large Language Models (LLMs) have demonstrated great potential in clinical and medical applications, making them a promising tool for supporting general practice. However, most existing benchmarks and evaluation frameworks focus on exam-style assessments-typically multiple-choice question-lack comprehensive assessment sets that accurately mirror the real-world scenarios encountered by GPs. To evaluate how effectively LLMs can make decisions in the daily work of GPs, we designed GPBench, which consists of both test questions from clinical practice and a novel evaluation framework. The test set includes multiple-choice questions that assess fundamental knowledge of general practice, as well as realistic, scenario-based problems. All questions are meticulously annotated by experts, incorporating rich fine-grained information related to clinical management. The proposed LLM evaluation framework is based on the competency model for general practice, providing a comprehensive methodology for assessing LLM performance in real-world settings. As the first large-model evaluation set targeting GP decision-making scenarios, GPBench allows us to evaluate current mainstream LLMs. Expert assessment and evaluation reveal that in areas such as disease staging, complication recognition, treatment detail, and medication usage, these models exhibit at least ten major shortcomings. Overall, existing LLMs are not yet suitable for independent use in real-world GP working scenarios without human oversight.",CL,22 Mar 2025
https://doi.org/10.48550/arXiv.2503.17579,Leveraging Human Production-Interpretation Asymmetries to Test LLM Cognitive Plausibility,"Suet-Ying Lam, Qingcheng Zeng, Jingyi Wu, Rob Voigt","Whether large language models (LLMs) process language similarly to humans has been the subject of much theoretical and practical debate. We examine this question through the lens of the production-interpretation distinction found in human sentence processing and evaluate the extent to which instruction-tuned LLMs replicate this distinction. Using an empirically documented asymmetry between production and interpretation in humans for implicit causality verbs as a testbed, we find that some LLMs do quantitatively and qualitatively reflect human-like asymmetries between production and interpretation. We demonstrate that whether this behavior holds depends upon both model size - with larger models more likely to reflect human-like patterns and the choice of meta-linguistic prompts used to elicit the behavior.",CL,21 Mar 2025
https://doi.org/10.48550/arXiv.2503.17523,Bayesian Teaching Enables Probabilistic Reasoning in Large Language Models,"Linlu Qiu, Fei Sha, Kelsey Allen, Yoon Kim, Tal Linzen, Sjoerd van Steenkiste","Artificial intelligence systems based on large language models (LLMs) are increasingly used as agents that interact with users and with the world. To do so successfully, LLMs need to construct internal representations of the world and form probabilistic beliefs about those representations. To provide a user with personalized recommendations, for example, the LLM needs to gradually infer the user's preferences, over the course of multiple interactions. To evaluate whether contemporary LLMs are able to do so, we use the Bayesian inference framework from probability theory, which lays out the optimal way to update an agent's beliefs as it receives new information. We first show that the LLMs do not update their beliefs as expected from the Bayesian framework, and that consequently their predictions do not improve as expected as more information becomes available, even less so than we find is the case for humans. To address this issue, we teach the LLMs to reason in a Bayesian manner by training them to mimic the predictions of an optimal Bayesian model. We find that this approach not only significantly improves the LLM's performance on the particular recommendation task it is trained on, but also enables generalization to other tasks. This suggests that this method endows the LLM with broader Bayesian reasoning skills. More generally, our results indicate that LLMs can learn about reasoning strategies effectively and generalize those skills to new domains, which in part explains LLMs' empirical success.",CL,21 Mar 2025
https://doi.org/10.48550/arXiv.2503.17514,Language Models May Verbatim Complete TextThey Were Not Explicitly Trained On,"Ken Ziyu Liu, Christopher A. Choquette-Choo, Matthew Jagielski, Peter Kairouz, Sanmi Koyejo, Percy Liang, Nicolas Papernot","An important question today is whether a given text was used to train a large language model (LLM). A \emph{completion} test is often employed: check if the LLM completes a sufficiently complex text. This, however, requires a ground-truth definition of membership; most commonly, it is defined as a member based on the $n$-gram overlap between the target text and any text in the dataset. In this work, we demonstrate that this $n$-gram based membership definition can be effectively gamed. We study scenarios where sequences are \emph{non-members} for a given $n$ and we find that completion tests still succeed. We find many natural cases of this phenomenon by retraining LLMs from scratch after removing all training samples that were completed; these cases include exact duplicates, near-duplicates, and even short overlaps. They showcase that it is difficult to find a single viable choice of $n$ for membership definitions. Using these insights, we design adversarial datasets that can cause a given target sequence to be completed without containing it, for any reasonable choice of $n$. Our findings highlight the inadequacy of $n$-gram membership, suggesting membership definitions fail to account for auxiliary information available to the training algorithm.",CL,21 Mar 2025
https://doi.org/10.48550/arXiv.2503.17509,Follow-up Question Generation For Enhanced Patient-Provider Conversations,"Joseph Gatto, Parker Seegmiller, Timothy Burdick, Inas S. Khayal, Sarah DeLozier, Sarah M. Preum","Follow-up question generation is an essential feature of dialogue systems as it can reduce conversational ambiguity and enhance modeling complex interactions. Conversational contexts often pose core NLP challenges such as (i) extracting relevant information buried in fragmented data sources, and (ii) modeling parallel thought processes. These two challenges occur frequently in medical dialogue as a doctor asks questions based not only on patient utterances but also their prior EHR data and current diagnostic hypotheses. Asking medical questions in asynchronous conversations compounds these issues as doctors can only rely on static EHR information to motivate follow-up questions.To address these challenges, we introduce FollowupQ, a novel framework for enhancing asynchronous medical conversation. FollowupQ is a multi-agent framework that processes patient messages and EHR data to generate personalized follow-up questions, clarifying patient-reported medical conditions. FollowupQ reduces requisite provider follow-up communications by 34%. It also improves performance by 17% and 5% on real and synthetic data, respectively. We also release the first public dataset of asynchronous medical messages with linked EHR data alongside 2,300 follow-up questions written by clinical experts for the wider NLP research community.",CL,21 Mar 2025
https://doi.org/10.48550/arXiv.2503.17489,Judge Anything: MLLM as a Judge Across Any Modality,"Shu Pu, Yaochen Wang, Dongping Chen, Yuhang Chen, Guohao Wang, Qi Qin, Zhongyi Zhang, Zhiyuan Zhang, Zetong Zhou, Shuang Gong, Yi Gui, Yao Wan, Philip S. Yu","Evaluating generative foundation models on open-ended multimodal understanding (MMU) and generation (MMG) tasks across diverse modalities (e.g., images, audio, video) poses significant challenges due to the complexity of cross-modal interactions. To this end, the idea of utilizing Multimodal LLMs (MLLMs) as automated judges has emerged, with encouraging results in assessing vision-language understanding tasks. Moving further, this paper extends MLLM-as-a-Judge across modalities to a unified manner by introducing two benchmarks, TaskAnything and JudgeAnything, to respectively evaluate the overall performance and judging capabilities of MLLMs across any-to-any modality tasks. Specifically, TaskAnything evaluates the MMU and MMG capabilities across 15 any-to-any modality categories, employing 1,500 queries curated from well-established benchmarks. Furthermore, JudgeAnything evaluates the judging capabilities of 5 advanced (e.g., GPT-4o and Gemini-2.0-Flash) from the perspectives of Pair Comparison and Score Evaluation, providing a standardized testbed that incorporates human judgments and detailed rubrics. Our extensive experiments reveal that while these MLLMs show promise in assessing MMU (i.e., achieving an average of 66.55% in Pair Comparison setting and 42.79% in Score Evaluation setting), they encounter significant challenges with MMG tasks (i.e., averaging only 53.37% in Pair Comparison setting and 30.05% in Score Evaluation setting), exposing cross-modality biases and hallucination issues. To address this, we present OmniArena, an automated platform for evaluating omni-models and multimodal reward models. Our work highlights the need for fairer evaluation protocols and stronger alignment with human preferences. The source code and dataset are publicly available at: this https URL.",CL,21 Mar 2025
https://doi.org/10.48550/arXiv.2503.17485,SaudiCulture: A Benchmark for Evaluating Large Language Models Cultural Competence within Saudi Arabia,"Lama Ayash, Hassan Alhuzali, Ashwag Alasmari, Sultan Aloufi","Large Language Models (LLMs) have demonstrated remarkable capabilities in natural language processing; however, they often struggle to accurately capture and reflect cultural nuances. This research addresses this challenge by focusing on Saudi Arabia, a country characterized by diverse dialects and rich cultural traditions. We introduce SaudiCulture, a novel benchmark designed to evaluate the cultural competence of LLMs within the distinct geographical and cultural contexts of Saudi Arabia. SaudiCulture is a comprehensive dataset of questions covering five major geographical regions, such as West, East, South, North, and Center, along with general questions applicable across all regions. The dataset encompasses a broad spectrum of cultural domains, including food, clothing, entertainment, celebrations, and crafts. To ensure a rigorous evaluation, SaudiCulture includes questions of varying complexity, such as open-ended, single-choice, and multiple-choice formats, with some requiring multiple correct answers. Additionally, the dataset distinguishes between common cultural knowledge and specialized regional aspects. We conduct extensive evaluations on five LLMs, such as GPT-4, Llama 3.3, FANAR, Jais, and AceGPT, analyzing their performance across different question types and cultural contexts. Our findings reveal that all models experience significant performance declines when faced with highly specialized or region-specific questions, particularly those requiring multiple correct responses. Additionally, certain cultural categories are more easily identifiable than others, further highlighting inconsistencies in LLMs cultural understanding. These results emphasize the importance of incorporating region-specific knowledge into LLMs training to enhance their cultural competence.",CL,21 Mar 2025
https://doi.org/10.48550/arXiv.2503.17460,ConvoGen: Enhancing Conversational AI with Synthetic Data: A Multi-Agent Approach,"Reem Gody, Mahmoud Goudy, Ahmed Y. Tawfik","In this paper, we present ConvoGen: an innovative framework for generating synthetic conversational data using multi-agent systems. Our method leverages few-shot learning and introduces iterative sampling from a dynamically updated few-shot hub to create diverse and realistic conversational scenarios. The generated data has numerous applications, including training and evaluating conversational AI models, and augmenting existing datasets for tasks like conversational intent classification or conversation summarization. Our experiments demonstrate the effectiveness of this method in producing high-quality diverse synthetic conversational data, highlighting its potential to enhance the development and evaluation of conversational AI systems.",CL,21 Mar 2025
https://doi.org/10.48550/arXiv.2503.17456,Language-specific Neurons Do Not Facilitate Cross-Lingual Transfer,"Soumen Kumar Mondal, Sayambhu Sen, Abhishek Singhania, Preethi Jyothi","Multilingual large language models (LLMs) aim towards robust natural language understanding across diverse languages, yet their performance significantly degrades on low-resource languages. This work explores whether existing techniques to identify language-specific neurons can be leveraged to enhance cross-lingual task performance of lowresource languages. We conduct detailed experiments covering existing language-specific neuron identification techniques (such as Language Activation Probability Entropy and activation probability-based thresholding) and neuron-specific LoRA fine-tuning with models like Llama 3.1 and Mistral Nemo. We find that such neuron-specific interventions are insufficient to yield cross-lingual improvements on downstream tasks (XNLI, XQuAD) in lowresource languages. This study highlights the challenges in achieving cross-lingual generalization and provides critical insights for multilingual LLMs.",CL,21 Mar 2025
https://doi.org/10.48550/arXiv.2503.17425,Beyond Negation Detection: Comprehensive Assertion Detection Models for Clinical NLP,"Veysel Kocaman, Yigit Gul, M. Aytug Kaya, Hasham Ul Haq, Mehmet Butgul, Cabir Celik, David Talby","Assertion status detection is a critical yet often overlooked component of clinical NLP, essential for accurately attributing extracted medical facts. Past studies have narrowly focused on negation detection, leading to underperforming commercial solutions such as AWS Medical Comprehend, Azure AI Text Analytics, and GPT-4o due to their limited domain adaptation. To address this gap, we developed state-of-the-art assertion detection models, including fine-tuned LLMs, transformer-based classifiers, few-shot classifiers, and deep learning (DL) approaches. We evaluated these models against cloud-based commercial API solutions, the legacy rule-based NegEx approach, and GPT-4o. Our fine-tuned LLM achieves the highest overall accuracy (0.962), outperforming GPT-4o (0.901) and commercial APIs by a notable margin, particularly excelling in Present (+4.2%), Absent (+8.4%), and Hypothetical (+23.4%) assertions. Our DL-based models surpass commercial solutions in Conditional (+5.3%) and Associated-with-Someone-Else (+10.1%) categories, while the few-shot classifier offers a lightweight yet highly competitive alternative (0.929), making it ideal for resource-constrained environments. Integrated within Spark NLP, our models consistently outperform black-box commercial solutions while enabling scalable inference and seamless integration with medical NER, Relation Extraction, and Terminology Resolution. These results reinforce the importance of domain-adapted, transparent, and customizable clinical NLP solutions over general-purpose LLMs and proprietary APIs.",CL,21 Mar 2025
https://doi.org/10.48550/arXiv.2503.17407,A Comprehensive Survey on Long Context Language Modeling,"Jiaheng Liu, Dawei Zhu, Zhiqi Bai, Yancheng He, Huanxuan Liao, Haoran Que, Zekun Wang, Chenchen Zhang, Ge Zhang, Jiebin Zhang, Yuanxing Zhang, Zhuo Chen, Hangyu Guo, Shilong Li, Ziqiang Liu, Yong Shan, Yifan Song, Jiayi Tian, Wenhao Wu, Zhejian Zhou, Ruijie Zhu, Junlan Feng, Yang Gao, Shizhu He, Zhoujun Li, Tianyu Liu, Fanyu Meng, Wenbo Su, Yingshui Tan, Zili Wang, Jian Yang, Wei Ye, Bo Zheng, Wangchunshu Zhou, Wenhao Huang, Sujian Li, Zhaoxiang Zhang","Efficient processing of long contexts has been a persistent pursuit in Natural Language Processing. With the growing number of long documents, dialogues, and other textual data, it is important to develop Long Context Language Models (LCLMs) that can process and analyze extensive inputs in an effective and efficient way. In this paper, we present a comprehensive survey on recent advances in long-context modeling for large language models. Our survey is structured around three key aspects: how to obtain effective and efficient LCLMs, how to train and deploy LCLMs efficiently, and how to evaluate and analyze LCLMs comprehensively. For the first aspect, we discuss data strategies, architectural designs, and workflow approaches oriented with long context processing. For the second aspect, we provide a detailed examination of the infrastructure required for LCLM training and inference. For the third aspect, we present evaluation paradigms for long-context comprehension and long-form generation, as well as behavioral analysis and mechanism interpretability of LCLMs. Beyond these three key aspects, we thoroughly explore the diverse application scenarios where existing LCLMs have been deployed and outline promising future development directions. This survey provides an up-to-date review of the literature on long-context LLMs, which we wish to serve as a valuable resource for both researchers and engineers. An associated GitHub repository collecting the latest papers and repos is available at: \href{this https URL}{\color[RGB]{175,36,67}{LCLM-Horizon}}.",CL,20 Mar 2025
https://doi.org/10.48550/arXiv.2503.17403,ChatGPT or A Silent Everywhere Helper: A Survey of Large Language Models,"Azim Akhtarshenas, Afshin Dini, Navid Ayoobi","Large Language Models (LLMs) have revo lutionized natural language processing Natural Language Processing (NLP), with Chat Generative Pre-trained Transformer (ChatGPT) standing out as a notable exampledue to its advanced capabilities and widespread applications. This survey provides a comprehensive analysis of ChatGPT, exploring its architecture, training processes, and functionalities. We examine its integration into various domains across industries such as customer service, education, healthcare, and entertainment. A comparative analysis with other LLMs highlights ChatGPT's unique features and performance metrics. Regarding benchmarks, the paper examines ChatGPT's comparative performance against other LLMs and discusses potential risks such as misinformation, bias, and data privacy concerns. Additionally, we offer a number of figures and tables that outline the backdrop of the discussion, the main ideas of the article, the numerous LLM models, a thorough list of datasets used for pre-training, fine-tuning, and evaluation, as well as particular LLM applications with pertinent references. Finally, we identify future research directions and technological advancements, underscoring the evolving landscape of LLMs and their profound impact on artificial intelligence Artificial Intelligence (AI) and society.",CL,19 Mar 2025
https://doi.org/10.48550/arXiv.2503.18941,Exploring Training and Inference Scaling Laws in Generative Retrieval,"Hongru Cai, Yongqi Li, Ruifeng Yuan, Wenjie Wang, Zhen Zhang, Wenjie Li, Tat-Seng Chua","Generative retrieval has emerged as a novel paradigm that leverages large language models (LLMs) to autoregressively generate document identifiers. Although promising, the mechanisms that underpin its performance and scalability remain largely unclear. We conduct a systematic investigation of training and inference scaling laws in generative retrieval, exploring how model size, training data scale, and inference-time compute jointly influence retrieval performance. To address the lack of suitable metrics, we propose a novel evaluation measure inspired by contrastive entropy and generation loss, providing a continuous performance signal that enables robust comparisons across diverse generative retrieval methods. Our experiments show that n-gram-based methods demonstrate strong alignment with both training and inference scaling laws, especially when paired with larger LLMs. Furthermore, increasing inference computation yields substantial performance gains, revealing that generative retrieval can significantly benefit from higher compute budgets at inference. Across these settings, LLaMA models consistently outperform T5 models, suggesting a particular advantage for larger decoder-only models in generative retrieval. Taken together, our findings underscore that model sizes, data availability, and inference computation interact to unlock the full potential of generative retrieval, offering new insights for designing and optimizing future systems.",CL,24 Mar 2025
https://doi.org/10.48550/arXiv.2503.18892,SimpleRL-Zoo: Investigating and Taming Zero Reinforcement Learning for Open Base Models in the Wild,"Weihao Zeng, Yuzhen Huang, Qian Liu, Wei Liu, Keqing He, Zejun Ma, Junxian He","DeepSeek-R1 has shown that long chain-of-thought (CoT) reasoning can naturally emerge through a simple reinforcement learning (RL) framework with rule-based rewards, where the training may directly start from the base models-a paradigm referred to as zero RL training. Most recent efforts to reproduce zero RL training have primarily focused on the Qwen2.5 model series, which may not be representative as we find the base models already exhibit strong instruction-following and self-reflection abilities. In this work, we investigate zero RL training across 10 diverse base models, spanning different families and sizes including LLama3-8B, Mistral-7B/24B, DeepSeek-Math-7B, Qwen2.5-math-7B, and all Qwen2.5 models from 0.5B to 32B. Leveraging several key design strategies-such as adjusting format reward and controlling query difficulty-we achieve substantial improvements in both reasoning accuracy and response length across most settings. However, by carefully monitoring the training dynamics, we observe that different base models exhibit distinct patterns during training. For instance, the increased response length does not always correlate with the emergence of certain cognitive behaviors such as verification (i.e., the ""aha moment""). Notably, we observe the ""aha moment"" for the first time in small models not from the Qwen family. We share the key designs that enable successful zero RL training, along with our findings and practices. To facilitate further research, we open-source the code, models, and analysis tools.",CL,24 Mar 2025
