DOI,Title,Authors,Abstract,Section,Date
https://doi.org/10.48550/arXiv.2503.18893,xKV: Cross-Layer SVD for KV-Cache Compression,"Chi-Chih Chang, Chien-Yu Lin, Yash Akhauri, Wei-Cheng Lin, Kai-Chiang Wu, Luis Ceze, Mohamed S. Abdelfattah","Large Language Models (LLMs) with long context windows enable powerful applications but come at the cost of high memory consumption to store the Key and Value states (KV-Cache). Recent studies attempted to merge KV-cache from multiple layers into shared representations, yet these approaches either require expensive pretraining or rely on assumptions of high per-token cosine similarity across layers which generally does not hold in practice. We find that the dominant singular vectors are remarkably well-aligned across multiple layers of the KV-Cache. Exploiting this insight, we propose xKV, a simple post-training method that applies Singular Value Decomposition (SVD) on the KV-Cache of grouped layers. xKV consolidates the KV-Cache of multiple layers into a shared low-rank subspace, significantly reducing KV-Cache sizes. Through extensive evaluations on the RULER long-context benchmark with widely-used LLMs (e.g., Llama-3.1 and Qwen2.5), xKV achieves up to 6.8x higher compression rates than state-of-the-art inter-layer technique while improving accuracy by 2.7%. Moreover, xKV is compatible with the emerging Multi-Head Latent Attention (MLA) (e.g., DeepSeek-Coder-V2), yielding a notable 3x compression rates on coding tasks without performance degradation. These results highlight xKV's strong capability and versatility in addressing memory bottlenecks for long-context LLM inference. Our code is publicly available at: this https URL.",CL,24 Mar 2025
https://doi.org/10.48550/arXiv.2503.18891,AgentDropout: Dynamic Agent Elimination for Token-Efficient and High-Performance LLM-Based Multi-Agent Collaboration,"Zhexuan Wang, Yutong Wang, Xuebo Liu, Liang Ding, Miao Zhang, Jie Liu, Min Zhang","Multi-agent systems (MAS) based on large language models (LLMs) have demonstrated significant potential in collaborative problem-solving. However, they still face substantial challenges of low communication efficiency and suboptimal task performance, making the careful design of the agents' communication topologies particularly important. Inspired by the management theory that roles in an efficient team are often dynamically adjusted, we propose AgentDropout, which identifies redundant agents and communication across different communication rounds by optimizing the adjacency matrices of the communication graphs and eliminates them to enhance both token efficiency and task performance. Compared to state-of-the-art methods, AgentDropout achieves an average reduction of 21.6% in prompt token consumption and 18.4% in completion token consumption, along with a performance improvement of 1.14 on the tasks. Furthermore, the extended experiments demonstrate that AgentDropout achieves notable domain transferability and structure robustness, revealing its reliability and effectiveness. We release our code at this https URL.",CL,24 Mar 2025
https://doi.org/10.48550/arXiv.2503.18878,I Have Covered All the Bases Here: Interpreting Reasoning Features in Large Language Models via Sparse Autoencoders,"Andrey Galichin, Alexey Dontsov, Polina Druzhinina, Anton Razzhigaev, Oleg Y. Rogov, Elena Tutubalina, Ivan Oseledets","Large Language Models (LLMs) have achieved remarkable success in natural language processing. Recent advances have led to the developing of a new class of reasoning LLMs; for example, open-source DeepSeek-R1 has achieved state-of-the-art performance by integrating deep thinking and complex reasoning. Despite these impressive capabilities, the internal reasoning mechanisms of such models remain unexplored. In this work, we employ Sparse Autoencoders (SAEs), a method to learn a sparse decomposition of latent representations of a neural network into interpretable features, to identify features that drive reasoning in the DeepSeek-R1 series of models. First, we propose an approach to extract candidate ''reasoning features'' from SAE representations. We validate these features through empirical analysis and interpretability methods, demonstrating their direct correlation with the model's reasoning abilities. Crucially, we demonstrate that steering these features systematically enhances reasoning performance, offering the first mechanistic account of reasoning in LLMs. Code available at this https URL",CL,24 Mar 2025
https://doi.org/10.48550/arXiv.2503.18769,AlphaSpace: Enabling Robotic Actions through Semantic Tokenization and Symbolic Reasoning,"Alan Dao (Gia Tuan Dao), Dinh Bach Vu, Bui Quang Huy","This paper presents AlphaSpace, a novel methodology designed to enhance the spatial reasoning capabilities of large language models (LLMs) for 3D Cartesian space navigation. AlphaSpace employs a semantics-based tokenization strategy, encoding height information through specialized semantic tokens, and integrates primarily symbolic synthetic reasoning data. This approach enables LLMs to accurately manipulate objects by positioning them at specific [x, y, z] coordinates. Experimental results demonstrate that AlphaSpace significantly outperforms existing models on manipulation subtasks, achieving a total accuracy of 66.67%, compared to 37.5% for GPT-4o and 29.17% for Claude 3.5 Sonnet.",CL,24 Mar 2025
https://doi.org/10.48550/arXiv.2503.18760,Synthetic Function Demonstrations Improve Generation in Low-Resource Programming Languages,"Nick McKenna, Xinnuo Xu, Jack Williams, Nick Wilson, Benjamin Van Durme, Christian Poelitz","A key consideration when training an LLM is whether the target language is more or less resourced, whether this is English compared to Welsh, or Python compared to Excel. Typical training data for programming languages consist of real program demonstrations coupled with human-written comments. Here we present novel approaches to the creation of such data for low resource programming languages. We generate fully-synthetic, textbook-quality demonstrations of common library functions in an example domain of Excel formulas, using a teacher model. We then finetune an underperforming student model, and show improvement on 2 question-answering datasets recast into the Excel domain. We show advantages of finetuning over standard, off-the-shelf RAG approaches, which can offer only modest improvement due to the unfamiliar target domain.",CL,24 Mar 2025
https://doi.org/10.48550/arXiv.2503.18751,Construction Identification and Disambiguation Using BERT: A Case Study of NPN,"Wesley Scivetti, Nathan Schneider","Construction Grammar hypothesizes that knowledge of a language consists chiefly of knowledge of form-meaning pairs (''constructions'') that include vocabulary, general grammar rules, and even idiosyncratic patterns. Recent work has shown that transformer language models represent at least some constructional patterns, including ones where the construction is rare overall. In this work, we probe BERT's representation of the form and meaning of a minor construction of English, the NPN (noun-preposition-noun) construction -- exhibited in such expressions as face to face and day to day -- which is known to be polysemous. We construct a benchmark dataset of semantically annotated corpus instances (including distractors that superficially resemble the construction). With this dataset, we train and evaluate probing classifiers. They achieve decent discrimination of the construction from distractors, as well as sense disambiguation among true instances of the construction, revealing that BERT embeddings carry indications of the construction's semantics. Moreover, artificially permuting the word order of true construction instances causes them to be rejected, indicating sensitivity to matters of form. We conclude that BERT does latently encode at least some knowledge of the NPN construction going beyond a surface syntactic pattern and lexical cues.",CL,24 Mar 2025
https://doi.org/10.48550/arXiv.2503.18730,Predicting the Road Ahead: A Knowledge Graph based Foundation Model for Scene Understanding in Autonomous Driving,"Hongkuan Zhou, Stefan Schmid, Yicong Li, Lavdim Halilaj, Xiangtong Yao, Wei cao","The autonomous driving field has seen remarkable advancements in various topics, such as object recognition, trajectory prediction, and motion planning. However, current approaches face limitations in effectively comprehending the complex evolutions of driving scenes over time. This paper proposes FM4SU, a novel methodology for training a symbolic foundation model (FM) for scene understanding in autonomous driving. It leverages knowledge graphs (KGs) to capture sensory observation along with domain knowledge such as road topology, traffic rules, or complex interactions between traffic participants. A bird's eye view (BEV) symbolic representation is extracted from the KG for each driving scene, including the spatio-temporal information among the objects across the scenes. The BEV representation is serialized into a sequence of tokens and given to pre-trained language models (PLMs) for learning an inherent understanding of the co-occurrence among driving scene elements and generating predictions on the next scenes. We conducted a number of experiments using the nuScenes dataset and KG in various scenarios. The results demonstrate that fine-tuned models achieve significantly higher accuracy in all tasks. The fine-tuned T5 model achieved a next scene prediction accuracy of 86.7%. This paper concludes that FM4SU offers a promising foundation for developing more comprehensive models for scene understanding in autonomous driving.",CL,24 Mar 2025
https://doi.org/10.48550/arXiv.2503.18702,Unsupervised Acquisition of Discrete Grammatical Categories,"David Ph. Shakouri, Crit Cremers, Niels O. Schiller","This article presents experiments performed using a computational laboratory environment for language acquisition experiments. It implements a multi-agent system consisting of two agents: an adult language model and a daughter language model that aims to learn the mother language. Crucially, the daughter agent does not have access to the internal knowledge of the mother language model but only to the language exemplars the mother agent generates. These experiments illustrate how this system can be used to acquire abstract grammatical knowledge. We demonstrate how statistical analyses of patterns in the input data corresponding to grammatical categories yield discrete grammatical rules. These rules are subsequently added to the grammatical knowledge of the daughter language model. To this end, hierarchical agglomerative cluster analysis was applied to the utterances consecutively generated by the mother language model. It is argued that this procedure can be used to acquire structures resembling grammatical categories proposed by linguists for natural languages. Thus, it is established that non-trivial grammatical knowledge has been acquired. Moreover, the parameter configuration of this computational laboratory environment determined using training data generated by the mother language model is validated in a second experiment with a test set similarly resulting in the acquisition of non-trivial categories.",CL,24 Mar 2025
https://doi.org/10.48550/arXiv.2503.18681,Commander-GPT: Fully Unleashing the Sarcasm Detection Capability of Multi-Modal Large Language Models,"Yazhou Zhang, Chunwang Zou, Bo Wang, Jing Qin","Sarcasm detection, as a crucial research direction in the field of Natural Language Processing (NLP), has attracted widespread attention. Traditional sarcasm detection tasks have typically focused on single-modal approaches (e.g., text), but due to the implicit and subtle nature of sarcasm, such methods often fail to yield satisfactory results. In recent years, researchers have shifted the focus of sarcasm detection to multi-modal approaches. However, effectively leveraging multi-modal information to accurately identify sarcastic content remains a challenge that warrants further exploration. Leveraging the powerful integrated processing capabilities of Multi-Modal Large Language Models (MLLMs) for various information sources, we propose an innovative multi-modal Commander-GPT framework. Inspired by military strategy, we first decompose the sarcasm detection task into six distinct sub-tasks. A central commander (decision-maker) then assigns the best-suited large language model to address each specific sub-task. Ultimately, the detection results from each model are aggregated to identify sarcasm. We conducted extensive experiments on MMSD and MMSD 2.0, utilizing four multi-modal large language models and six prompting strategies. Our experiments demonstrate that our approach achieves state-of-the-art performance, with a 19.3% improvement in F1 score, without necessitating fine-tuning or ground-truth rationales.",CL,24 Mar 2025
https://doi.org/10.48550/arXiv.2503.18646,ZeroLM: Data-Free Transformer Architecture Search for Language Models,"Zhen-Song Chen, Hong-Wei Ding, Xian-Jia Wang, Witold Pedrycz","Neural architecture search (NAS) provides a systematic framework for automating the design of neural network architectures, yet its widespread adoption is hindered by prohibitive computational requirements. Existing zero-cost proxy methods, while reducing search overhead, demonstrate inadequate performance in architecture ranking tasks, particularly for Transformer-based models where they often underperform simple parameter counting metrics. Current automated proxy discovery approaches suffer from extended search times, susceptibility to data overfitting, and structural complexity. This paper introduces a novel zero-cost proxy methodology that quantifies model capacity through efficient weight statistics computation while decomposing Transformer architectures into functionally distinct sub-modules, thereby optimizing the balance of their contributions to overall performance. Our comprehensive evaluation demonstrates the superiority of this approach, achieving a Spearman's rho of 0.76 and Kendall's tau of 0.53 on the FlexiBERT benchmark. The proposed method exhibits exceptional computational efficiency while maintaining robust performance across diverse NAS benchmark tasks, offering a practical solution for large-scale architecture search.",CL,24 Mar 2025
https://doi.org/10.48550/arXiv.2503.18603,LANGALIGN: Enhancing Non-English Language Models via Cross-Lingual Embedding Alignment,"Jong Myoung Kim, Young-Jun Lee, Ho-Jin Choi, Sangkeun Jung","While Large Language Models have gained attention, many service developers still rely on embedding-based models due to practical constraints. In such cases, the quality of fine-tuning data directly impacts performance, and English datasets are often used as seed data for training non-English models. In this study, we propose LANGALIGN, which enhances target language processing by aligning English embedding vectors with those of the target language at the interface between the language model and the task header. Experiments on Korean, Japanese, and Chinese demonstrate that LANGALIGN significantly improves performance across all three languages. Additionally, we show that LANGALIGN can be applied in reverse to convert target language data into a format that an English-based model can process.",CL,24 Mar 2025
https://doi.org/10.48550/arXiv.2503.18596,LinkAlign: Scalable Schema Linking for Real-World Large-Scale Multi-Database Text-to-SQL,"Yihan Wang, Peiyu Liu, Xin Yang","Schema linking is a critical bottleneck in achieving human-level performance in Text-to-SQL tasks, particularly in real-world large-scale multi-database scenarios. Addressing schema linking faces two major challenges: (1) Database Retrieval: selecting the correct database from a large schema pool in multi-database settings, while filtering out irrelevant ones. (2) Schema Item Grounding: accurately identifying the relevant tables and columns from within a large and redundant schema for SQL generation. To address this, we introduce LinkAlign, a novel framework that can effectively adapt existing baselines to real-world environments by systematically addressing schema linking. Our framework comprises three key steps: multi-round semantic enhanced retrieval and irrelevant information isolation for Challenge 1, and schema extraction enhancement for Challenge 2. We evaluate our method performance of schema linking on the SPIDER and BIRD benchmarks, and the ability to adapt existing Text-to-SQL models to real-world environments on the SPIDER 2.0-lite benchmark. Experiments show that LinkAlign outperforms existing baselines in multi-database settings, demonstrating its effectiveness and robustness. On the other hand, our method ranks highest among models excluding those using long chain-of-thought reasoning LLMs. This work bridges the gap between current research and real-world scenarios, providing a practical solution for robust and scalable schema linking. The codes are available at this https URL.",CL,24 Mar 2025
https://doi.org/10.48550/arXiv.2503.18594,ClinText-SP and RigoBERTa Clinical: a new set of open resources for Spanish Clinical NLP,"Guillem García Subies, Álvaro Barbero Jiménez, Paloma Martínez Fernández","We present a novel contribution to Spanish clinical natural language processing by introducing the largest publicly available clinical corpus, ClinText-SP, along with a state-of-the-art clinical encoder language model, RigoBERTa Clinical. Our corpus was meticulously curated from diverse open sources, including clinical cases from medical journals and annotated corpora from shared tasks, providing a rich and diverse dataset that was previously difficult to access. RigoBERTa Clinical, developed through domain-adaptive pretraining on this comprehensive dataset, significantly outperforms existing models on multiple clinical NLP benchmarks. By publicly releasing both the dataset and the model, we aim to empower the research community with robust resources that can drive further advancements in clinical NLP and ultimately contribute to improved healthcare applications.",CL,24 Mar 2025
https://doi.org/10.48550/arXiv.2503.18562,"Self-Reported Confidence of Large Language Models in Gastroenterology: Analysis of Commercial, Open-Source, and Quantized Models","Nariman Naderi, Seyed Amir Ahmad Safavi-Naini, Thomas Savage, Zahra Atf, Peter Lewis, Girish Nadkarni, Ali Soroush","This study evaluated self-reported response certainty across several large language models (GPT, Claude, Llama, Phi, Mistral, Gemini, Gemma, and Qwen) using 300 gastroenterology board-style questions. The highest-performing models (GPT-o1 preview, GPT-4o, and Claude-3.5-Sonnet) achieved Brier scores of 0.15-0.2 and AUROC of 0.6. Although newer models demonstrated improved performance, all exhibited a consistent tendency towards overconfidence. Uncertainty estimation presents a significant challenge to the safe use of LLMs in healthcare. Keywords: Large Language Models; Confidence Elicitation; Artificial Intelligence; Gastroenterology; Uncertainty Quantification",CL,24 Mar 2025
https://doi.org/10.48550/arXiv.2503.18539,"Natural Language Processing for Electronic Health Records in Scandinavian Languages: Norwegian, Swedish, and Danish","Ashenafi Zebene Woldaregay, Jørgen Aarmo Lund, Phuong Dinh Ngo, Mariyam Tayefi, Joel Burman, Stine Hansen, Martin Hylleholt Sillesen, Hercules Dalianis, Robert Jenssen, Lindsetmo Rolf Ole, Karl Øyvind Mikalsen","Background: Clinical natural language processing (NLP) refers to the use of computational methods for extracting, processing, and analyzing unstructured clinical text data, and holds a huge potential to transform healthcare in various clinical tasks. Objective: The study aims to perform a systematic review to comprehensively assess and analyze the state-of-the-art NLP methods for the mainland Scandinavian clinical text. Method: A literature search was conducted in various online databases including PubMed, ScienceDirect, Google Scholar, ACM digital library, and IEEE Xplore between December 2022 and February 2024. Further, relevant references to the included articles were also used to solidify our search. The final pool includes articles that conducted clinical NLP in the mainland Scandinavian languages and were published in English between 2010 and 2024. Results: Out of the 113 articles, 18% (n=21) focus on Norwegian clinical text, 64% (n=72) on Swedish, 10% (n=11) on Danish, and 8% (n=9) focus on more than one language. Generally, the review identified positive developments across the region despite some observable gaps and disparities between the languages. There are substantial disparities in the level of adoption of transformer-based models. In essential tasks such as de-identification, there is significantly less research activity focusing on Norwegian and Danish compared to Swedish text. Further, the review identified a low level of sharing resources such as data, experimentation code, pre-trained models, and rate of adaptation and transfer learning in the region. Conclusion: The review presented a comprehensive assessment of the state-of-the-art Clinical NLP for electronic health records (EHR) text in mainland Scandinavian languages and, highlighted the potential barriers and challenges that hinder the rapid advancement of the field in the region.",CL,24 Mar 2025
https://doi.org/10.48550/arXiv.2503.18526,SciClaims: An End-to-End Generative System for Biomedical Claim Analysis,"Raúl Ortega, José Manuel Gómez-Pérez","Validating key claims in scientific literature, particularly in biomedical research, is essential for ensuring accuracy and advancing knowledge. This process is critical in sectors like the pharmaceutical industry, where rapid scientific progress requires automation and deep domain expertise. However, current solutions have significant limitations. They lack end-to-end pipelines encompassing all claim extraction, evidence retrieval, and verification steps; rely on complex NLP and information retrieval pipelines prone to multiple failure points; and often fail to provide clear, user-friendly justifications for claim verification outcomes. To address these challenges, we introduce SciClaims, an advanced system powered by state-of-the-art large language models (LLMs) that seamlessly integrates the entire scientific claim analysis process. SciClaims outperforms previous approaches in both claim extraction and verification without requiring additional fine-tuning, setting a new benchmark for automated scientific claim analysis.",CL,24 Mar 2025
https://doi.org/10.48550/arXiv.2503.18502,Autoregressive Language Models for Knowledge Base Population: A case study in the space mission domain,"Andrés García-Silva, José Manuel Gómez-Pérez","Knowledge base population KBP plays a crucial role in populating and maintaining knowledge bases up-to-date in organizations by leveraging domain corpora. Motivated by the increasingly large context windows supported by large language models, we propose to fine-tune an autoregressive language model for end-toend KPB. Our case study involves the population of a space mission knowledge graph. To fine-tune the model we generate a dataset for end-to-end KBP tapping into existing domain resources. Our case study shows that fine-tuned language models of limited size can achieve competitive and even higher accuracy than larger models in the KBP task. Smaller models specialized for KBP offer affordable deployment and lower-cost inference. Moreover, KBP specialist models do not require the ontology to be included in the prompt, allowing for more space in the context for additional input text or output serialization.",CL,24 Mar 2025
https://doi.org/10.48550/arXiv.2503.18491,MAGIC-VQA: Multimodal And Grounded Inference with Commonsense Knowledge for Visual Question Answering,"Shuo Yang, Siwen Luo, Soyeon Caren Han, Eduard Hovy","Visual Question Answering (VQA) requires reasoning across visual and textual modalities, yet Large Vision-Language Models (LVLMs) often lack integrated commonsense knowledge, limiting their robustness in real-world scenarios. To address this, we introduce MAGIC-VQA, a novel framework that enhances VQA by systematically integrating commonsense knowledge with LVLMs. MAGIC-VQA employs a three-stage process: (1) Explicit Knowledge Integration from external sources, (2) By-Type Post-Processing for contextual refinement, and (3) Implicit Knowledge Augmentation using a Graph Neural Network (GNN) for structured reasoning. While GNNs bring greater depth to structured inference, they enable superior relational inference beyond LVLMs. MAGIC-VQA bridges a key gap by unifying commonsensse knowledge with LVLM-driven reasoning, eliminating the need for extensive pre-training or complex prompt tuning. Our framework achieves state-of-the-art performance on benchmark datasets, significantly improving commonsense reasoning in VQA.",CL,24 Mar 2025
