DOI,Title,Authors,Abstract,Section,Date
https://doi.org/10.48550/arXiv.2503.16858,MTBench: A Multimodal Time Series Benchmark for Temporal Reasoning and Question Answering,"Jialin Chen, Aosong Feng, Ziyu Zhao, Juan Garza, Gaukhar Nurbek, Cheng Qin, Ali Maatouk, Leandros Tassiulas, Yifeng Gao, Rex Ying","Understanding the relationship between textual news and time-series evolution is a critical yet under-explored challenge in applied data science. While multimodal learning has gained traction, existing multimodal time-series datasets fall short in evaluating cross-modal reasoning and complex question answering, which are essential for capturing complex interactions between narrative information and temporal patterns. To bridge this gap, we introduce Multimodal Time Series Benchmark (MTBench), a large-scale benchmark designed to evaluate large language models (LLMs) on time series and text understanding across financial and weather domains. MTbench comprises paired time series and textual data, including financial news with corresponding stock price movements and weather reports aligned with historical temperature records. Unlike existing benchmarks that focus on isolated modalities, MTbench provides a comprehensive testbed for models to jointly reason over structured numerical trends and unstructured textual narratives. The richness of MTbench enables formulation of diverse tasks that require a deep understanding of both text and time-series data, including time-series forecasting, semantic and technical trend analysis, and news-driven question answering (QA). These tasks target the model's ability to capture temporal dependencies, extract key insights from textual context, and integrate cross-modal information. We evaluate state-of-the-art LLMs on MTbench, analyzing their effectiveness in modeling the complex relationships between news narratives and temporal patterns. Our findings reveal significant challenges in current models, including difficulties in capturing long-term dependencies, interpreting causality in financial and weather trends, and effectively fusing multimodal information.",CL,21 Mar 2025
https://doi.org/10.48550/arXiv.2503.16856,MMCR: Benchmarking Cross-Source Reasoning in Scientific Papers,"Yang Tian, Zheng Lu, Mingqi Gao, Zheng Liu, Bo Zhao","Fully comprehending scientific papers by machines reflects a high level of Artificial General Intelligence, requiring the ability to reason across fragmented and heterogeneous sources of information, presenting a complex and practically significant challenge. While Vision-Language Models (VLMs) have made remarkable strides in various tasks, particularly those involving reasoning with evidence source from single image or text page, their ability to use cross-source information for reasoning remains an open problem. This work presents MMCR, a high-difficulty benchmark designed to evaluate VLMs' capacity for reasoning with cross-source information from scientific papers. The benchmark comprises 276 high-quality questions, meticulously annotated by humans across 7 subjects and 10 task types. Experiments with 18 VLMs demonstrate that cross-source reasoning presents a substantial challenge for existing models. Notably, even the top-performing model, GPT-4o, achieved only 48.55% overall accuracy, with only 20% accuracy in multi-table comprehension tasks, while the second-best model, Qwen2.5-VL-72B, reached 39.86% overall accuracy. Furthermore, we investigated the impact of the Chain-of-Thought (CoT) technique on cross-source reasoning and observed a detrimental effect on small models, whereas larger models demonstrated substantially enhanced performance. These results highlight the pressing need to develop VLMs capable of effectively utilizing cross-source information for reasoning.",CL,21 Mar 2025
https://doi.org/10.48550/arXiv.2503.16853,Imagine to Hear: Auditory Knowledge Generation can be an Effective Assistant for Language Models,"Suho Yoo, Hyunjong Ok, Jaeho Lee","Language models pretrained on text-only corpora often struggle with tasks that require auditory commonsense knowledge. Previous work addresses this problem by augmenting the language model to retrieve knowledge from external audio databases. This approach has several limitations, such as the potential lack of relevant audio in databases and the high costs associated with constructing and querying the databases. To address these issues, we propose Imagine to Hear, a novel approach that dynamically generates auditory knowledge using generative models. Our framework detects multiple audio-related textual spans from the given prompt and generates corresponding auditory knowledge. We develop several mechanisms to efficiently process multiple auditory knowledge, including a CLAP-based rejection sampler and a language-audio fusion module. Our experiments show that our method achieves state-of-the-art performance on AuditoryBench without relying on external databases, highlighting the effectiveness of our generation-based approach.",CL,21 Mar 2025
https://doi.org/10.48550/arXiv.2503.16826,When Tom Eats Kimchi: Evaluating Cultural Bias of Multimodal Large Language Models in Cultural Mixture Contexts,"Jun Seong Kim, Kyaw Ye Thu, Javad Ismayilzada, Junyeong Park, Eunsu Kim, Huzama Ahmad, Na Min An, James Thorne, Alice Oh","In a highly globalized world, it is important for multi-modal large language models (MLLMs) to recognize and respond correctly to mixed-cultural inputs. For example, a model should correctly identify kimchi (Korean food) in an image both when an Asian woman is eating it, as well as an African man is eating it. However, current MLLMs show an over-reliance on the visual features of the person, leading to misclassification of the entities. To examine the robustness of MLLMs to different ethnicity, we introduce MixCuBe, a cross-cultural bias benchmark, and study elements from five countries and four ethnicities. Our findings reveal that MLLMs achieve both higher accuracy and lower sensitivity to such perturbation for high-resource cultures, but not for low-resource cultures. GPT-4o, the best-performing model overall, shows up to 58% difference in accuracy between the original and perturbed cultural settings in low-resource cultures. Our dataset is publicly available at: this https URL.",CL,21 Mar 2025
https://doi.org/10.48550/arXiv.2503.16789,Conversational User-AI Intervention: A Study on Prompt Rewriting for Improved LLM Response Generation,"Rupak Sarkar, Bahareh Sarrafzadeh, Nirupama Chandrasekaran, Nagu Rangan, Philip Resnik, Longqi Yang, Sujay Kumar Jauhar","Human-LLM conversations are increasingly becoming more pervasive in peoples' professional and personal lives, yet many users still struggle to elicit helpful responses from LLM Chatbots. One of the reasons for this issue is users' lack of understanding in crafting effective prompts that accurately convey their information needs. Meanwhile, the existence of real-world conversational datasets on the one hand, and the text understanding faculties of LLMs on the other, present a unique opportunity to study this problem, and its potential solutions at scale. Thus, in this paper we present the first LLM-centric study of real human-AI chatbot conversations, focused on investigating aspects in which user queries fall short of expressing information needs, and the potential of using LLMs to rewrite suboptimal user prompts. Our findings demonstrate that rephrasing ineffective prompts can elicit better responses from a conversational system, while preserving the user's original intent. Notably, the performance of rewrites improves in longer conversations, where contextual inferences about user needs can be made more accurately. Additionally, we observe that LLMs often need to -- and inherently do -- make \emph{plausible} assumptions about a user's intentions and goals when interpreting prompts. Our findings largely hold true across conversational domains, user intents, and LLMs of varying sizes and families, indicating the promise of using prompt rewriting as a solution for better human-AI interactions.",CL,21 Mar 2025
https://doi.org/10.48550/arXiv.2503.16779,Chain-of-Tools: Utilizing Massive Unseen Tools in the CoT Reasoning of Frozen Language Models,"Mengsong Wu, Tong Zhu, Han Han, Xiang Zhang, Wenbiao Shao, Wenliang Chen","Tool learning can further broaden the usage scenarios of large language models (LLMs). However most of the existing methods either need to finetune that the model can only use tools seen in the training data, or add tool demonstrations into the prompt with lower efficiency. In this paper, we present a new Tool Learning method Chain-of-Tools. It makes full use of the powerful semantic representation capability of frozen LLMs to finish tool calling in CoT reasoning with a huge and flexible tool pool which may contain unseen tools. Especially, to validate the effectiveness of our approach in the massive unseen tool scenario, we construct a new dataset SimpleToolQuestions. We conduct experiments on two numerical reasoning benchmarks (GSM8K-XL and FuncQA) and two knowledge-based question answering benchmarks (KAMEL and SimpleToolQuestions). Experimental results show that our approach performs better than the baseline. We also identify dimensions of the model output that are critical in tool selection, enhancing the model interpretability. Our code and data are available at: this https URL .",CL,21 Mar 2025
https://doi.org/10.48550/arXiv.2503.16745,SPACER: A Parallel Dataset of Speech Production And Comprehension of Error Repairs,"Shiva Upadhye, Jiaxuan Li, Richard Futrell","Speech errors are a natural part of communication, yet they rarely lead to complete communicative failure because both speakers and comprehenders can detect and correct errors. Although prior research has examined error monitoring and correction in production and comprehension separately, integrated investigation of both systems has been impeded by the scarcity of parallel data. In this study, we present SPACER, a parallel dataset that captures how naturalistic speech errors are corrected by both speakers and comprehenders. We focus on single-word substitution errors extracted from the Switchboard corpus, accompanied by speaker's self-repairs and comprehenders' responses from an offline text-editing experiment. Our exploratory analysis suggests asymmetries in error correction strategies: speakers are more likely to repair errors that introduce greater semantic and phonemic deviations, whereas comprehenders tend to correct errors that are phonemically similar to more plausible alternatives or do not fit into prior contexts. Our dataset enables future research on integrated approaches toward studying language production and comprehension.",CL,20 Mar 2025
https://doi.org/10.48550/arXiv.2503.16728,Natural Language Generation,"Emiel van Miltenburg, Chenghua Lin","This article provides a brief overview of the field of Natural Language Generation. The term Natural Language Generation (NLG), in its broadest definition, refers to the study of systems that verbalize some form of information through natural language. That information could be stored in a large database or knowledge graph (in data-to-text applications), but NLG researchers may also study summarisation (text-to-text) or image captioning (image-to-text), for example. As a subfield of Natural Language Processing, NLG is closely related to other sub-disciplines such as Machine Translation (MT) and Dialog Systems. Some NLG researchers exclude MT from their definition of the field, since there is no content selection involved where the system has to determine what to say. Conversely, dialog systems do not typically fall under the header of Natural Language Generation since NLG is just one component of dialog systems (the others being Natural Language Understanding and Dialog Management). However, with the rise of Large Language Models (LLMs), different subfields of Natural Language Processing have converged on similar methodologies for the production of natural language and the evaluation of automatically generated text.",CL,20 Mar 2025
https://doi.org/10.48550/arXiv.2503.16674,"Through the LLM Looking Glass: A Socratic Self-Assessment of Donkeys, Elephants, and Markets","Molly Kennedy, Ayyoob Imani, Timo Spinde, Hinrich Schütze","While detecting and avoiding bias in LLM-generated text is becoming increasingly important, media bias often remains subtle and subjective, making it particularly difficult to identify and mitigate. In this study, we assess media bias in LLM-generated content and LLMs' ability to detect subtle ideological bias. We conduct this evaluation using two datasets, PoliGen and EconoLex, covering political and economic discourse, respectively. We evaluate eight widely used LLMs by prompting them to generate articles and analyze their ideological preferences via self-assessment. By using self-assessment, the study aims to directly measure the models' biases rather than relying on external interpretations, thereby minimizing subjective judgments about media bias. Our results reveal a consistent preference of Democratic over Republican positions across all models. Conversely, in economic topics, biases vary among Western LLMs, while those developed in China lean more strongly toward socialism.",CL,20 Mar 2025
https://doi.org/10.48550/arXiv.2503.16655,Accelerating Antibiotic Discovery with Large Language Models and Knowledge Graphs,"Maxime Delmas, Magdalena Wysocka, Danilo Gusicuma, André Freitas","The discovery of novel antibiotics is critical to address the growing antimicrobial resistance (AMR). However, pharmaceutical industries face high costs (over $1 billion), long timelines, and a high failure rate, worsened by the rediscovery of known compounds. We propose an LLM-based pipeline that acts as an alarm system, detecting prior evidence of antibiotic activity to prevent costly rediscoveries. The system integrates organism and chemical literature into a Knowledge Graph (KG), ensuring taxonomic resolution, synonym handling, and multi-level evidence classification. We tested the pipeline on a private list of 73 potential antibiotic-producing organisms, disclosing 12 negative hits for evaluation. The results highlight the effectiveness of the pipeline for evidence reviewing, reducing false negatives, and accelerating decision-making. The KG for negative hits and the user interface for interactive exploration will be made publicly available.",CL,20 Mar 2025
https://doi.org/10.48550/arXiv.2503.16622,Leveraging Large Language Models for Explainable Activity Recognition in Smart Homes: A Critical Evaluation,"Michele Fiori, Gabriele Civitarese, Priyankar Choudhary, Claudio Bettini","Explainable Artificial Intelligence (XAI) aims to uncover the inner reasoning of machine learning models. In IoT systems, XAI improves the transparency of models processing sensor data from multiple heterogeneous devices, ensuring end-users understand and trust their outputs. Among the many applications, XAI has also been applied to sensor-based Activities of Daily Living (ADLs) recognition in smart homes. Existing approaches highlight which sensor events are most important for each predicted activity, using simple rules to convert these events into natural language explanations for non-expert users. However, these methods produce rigid explanations lacking natural language flexibility and are not scalable. With the recent rise of Large Language Models (LLMs), it is worth exploring whether they can enhance explanation generation, considering their proven knowledge of human activities. This paper investigates potential approaches to combine XAI and LLMs for sensor-based ADL recognition. We evaluate if LLMs can be used: a) as explainable zero-shot ADL recognition models, avoiding costly labeled data collection, and b) to automate the generation of explanations for existing data-driven XAI approaches when training data is available and the goal is higher recognition rates. Our critical evaluation provides insights into the benefits and challenges of using LLMs for explainable ADL recognition.",CL,20 Mar 2025
https://doi.org/10.48550/arXiv.2503.16614,Classification of User Reports for Detection of Faulty Computer Components using NLP Models: A Case Study,"Maria de Lourdes M. Silva, André L. C. Mendonça, Eduardo R. D. Neto, Iago C. Chaves, Felipe T. Brito, Victor A. E. Farias, Javam C. Machado","Computer manufacturers typically offer platforms for users to report faults. However, there remains a significant gap in these platforms' ability to effectively utilize textual reports, which impedes users from describing their issues in their own words. In this context, Natural Language Processing (NLP) offers a promising solution, by enabling the analysis of user-generated text. This paper presents an innovative approach that employs NLP models to classify user reports for detecting faulty computer components, such as CPU, memory, motherboard, video card, and more. In this work, we build a dataset of 341 user reports obtained from many sources. Additionally, through extensive experimental evaluation, our approach achieved an accuracy of 79% with our dataset.",CL,20 Mar 2025
https://doi.org/10.48550/arXiv.2503.16585,"Distributed LLMs and Multimodal Large Language Models: A Survey on Advances, Challenges, and Future Directions","Hadi Amini, Md Jueal Mia, Yasaman Saadati, Ahmed Imteaj, Seyedsina Nabavirazavi, Urmish Thakker, Md Zarif Hossain, Awal Ahmed Fime, S.S. Iyengar","Language models (LMs) are machine learning models designed to predict linguistic patterns by estimating the probability of word sequences based on large-scale datasets, such as text. LMs have a wide range of applications in natural language processing (NLP) tasks, including autocomplete and machine translation. Although larger datasets typically enhance LM performance, scalability remains a challenge due to constraints in computational power and resources. Distributed computing strategies offer essential solutions for improving scalability and managing the growing computational demand. Further, the use of sensitive datasets in training and deployment raises significant privacy concerns. Recent research has focused on developing decentralized techniques to enable distributed training and inference while utilizing diverse computational resources and enabling edge AI. This paper presents a survey on distributed solutions for various LMs, including large language models (LLMs), vision language models (VLMs), multimodal LLMs (MLLMs), and small language models (SLMs). While LLMs focus on processing and generating text, MLLMs are designed to handle multiple modalities of data (e.g., text, images, and audio) and to integrate them for broader applications. To this end, this paper reviews key advancements across the MLLM pipeline, including distributed training, inference, fine-tuning, and deployment, while also identifying the contributions, limitations, and future areas of improvement. Further, it categorizes the literature based on six primary focus areas of decentralization. Our analysis describes gaps in current methodologies for enabling distributed solutions for LMs and outline future research directions, emphasizing the need for novel solutions to enhance the robustness and applicability of distributed LMs.",CL,20 Mar 2025
https://doi.org/10.48550/arXiv.2503.18950,Target-Aware Video Diffusion Models,"Taeksoo Kim, Hanbyul Joo","We present a target-aware video diffusion model that generates videos from an input image in which an actor interacts with a specified target while performing a desired action. The target is defined by a segmentation mask and the desired action is described via a text prompt. Unlike existing controllable image-to-video diffusion models that often rely on dense structural or motion cues to guide the actor's movements toward the target, our target-aware model requires only a simple mask to indicate the target, leveraging the generalization capabilities of pretrained models to produce plausible actions. This makes our method particularly effective for human-object interaction (HOI) scenarios, where providing precise action guidance is challenging, and further enables the use of video diffusion models for high-level action planning in applications such as robotics. We build our target-aware model by extending a baseline model to incorporate the target mask as an additional input. To enforce target awareness, we introduce a special token that encodes the target's spatial information within the text prompt. We then fine-tune the model with our curated dataset using a novel cross-attention loss that aligns the cross-attention maps associated with this token with the input target mask. To further improve performance, we selectively apply this loss to the most semantically relevant transformer blocks and attention regions. Experimental results show that our target-aware model outperforms existing solutions in generating videos where actors interact accurately with the specified targets. We further demonstrate its efficacy in two downstream applications: video content creation and zero-shot 3D HOI motion synthesis.",CV,24 Mar 2025
https://doi.org/10.48550/arXiv.2503.18948,Equivariant Image Modeling,"Ruixiao Dong, Mengde Xu, Zigang Geng, Li Li, Han Hu, Shuyang Gu","Current generative models, such as autoregressive and diffusion approaches, decompose high-dimensional data distribution learning into a series of simpler subtasks. However, inherent conflicts arise during the joint optimization of these subtasks, and existing solutions fail to resolve such conflicts without sacrificing efficiency or scalability. We propose a novel equivariant image modeling framework that inherently aligns optimization targets across subtasks by leveraging the translation invariance of natural visual signals. Our method introduces (1) column-wise tokenization which enhances translational symmetry along the horizontal axis, and (2) windowed causal attention which enforces consistent contextual relationships across positions. Evaluated on class-conditioned ImageNet generation at 256x256 resolution, our approach achieves performance comparable to state-of-the-art AR models while using fewer computational resources. Systematic analysis demonstrates that enhanced equivariance reduces inter-task conflicts, significantly improving zero-shot generalization and enabling ultra-long image synthesis. This work establishes the first framework for task-aligned decomposition in generative modeling, offering insights into efficient parameter sharing and conflict-free optimization. The code and models are publicly available at this https URL.",CV,24 Mar 2025
https://doi.org/10.48550/arXiv.2503.18947,Tuning-Free Amodal Segmentation via the Occlusion-Free Bias of Inpainting Models,"Jae Joong Lee, Bedrich Benes, Raymond A. Yeh","Amodal segmentation aims to predict segmentation masks for both the visible and occluded regions of an object. Most existing works formulate this as a supervised learning problem, requiring manually annotated amodal masks or synthetic training data. Consequently, their performance depends on the quality of the datasets, which often lack diversity and scale. This work introduces a tuning-free approach that repurposes pretrained diffusion-based inpainting models for amodal segmentation. Our approach is motivated by the ""occlusion-free bias"" of inpainting models, i.e., the inpainted objects tend to be complete objects without occlusions. Specifically, we reconstruct the occluded regions of an object via inpainting and then apply segmentation, all without additional training or fine-tuning. Experiments on five datasets demonstrate the generalizability and robustness of our approach. On average, our approach achieves 5.3% more accurate masks over the state-of-the-art.",CV,24 Mar 2025
https://doi.org/10.48550/arXiv.2503.18945,Aether: Geometric-Aware Unified World Modeling,"Aether Team, Haoyi Zhu, Yifan Wang, Jianjun Zhou, Wenzheng Chang, Yang Zhou, Zizun Li, Junyi Chen, Chunhua Shen, Jiangmiao Pang, Tong He","The integration of geometric reconstruction and generative modeling remains a critical challenge in developing AI systems capable of human-like spatial reasoning. This paper proposes Aether, a unified framework that enables geometry-aware reasoning in world models by jointly optimizing three core capabilities: (1) 4D dynamic reconstruction, (2) action-conditioned video prediction, and (3) goal-conditioned visual planning. Through task-interleaved feature learning, Aether achieves synergistic knowledge sharing across reconstruction, prediction, and planning objectives. Building upon video generation models, our framework demonstrates unprecedented synthetic-to-real generalization despite never observing real-world data during training. Furthermore, our approach achieves zero-shot generalization in both action following and reconstruction tasks, thanks to its intrinsic geometric modeling. Remarkably, even without real-world data, its reconstruction performance far exceeds that of domain-specific models. Additionally, Aether leverages a geometry-informed action space to seamlessly translate predictions into actions, enabling effective autonomous trajectory planning. We hope our work inspires the community to explore new frontiers in physically-reasonable world modeling and its applications.",CV,24 Mar 2025
