DOI,Title,Authors,Abstract,Section,Date
https://doi.org/10.48550/arXiv.2503.18548,Benchmarking Post-Hoc Unknown-Category Detection in Food Recognition,"Lubnaa Abdur Rahman, Ioannis Papathanail, Lorenzo Brigato, Stavroula Mougiakakou","Food recognition models often struggle to distinguish between seen and unseen samples, frequently misclassifying samples from unseen categories by assigning them an in-distribution (ID) label. This misclassification presents significant challenges when deploying these models in real-world applications, particularly within automatic dietary assessment systems, where incorrect labels can lead to cascading errors throughout the system. Ideally, such models should prompt the user when an unknown sample is encountered, allowing for corrective action. Given no prior research exploring food recognition in real-world settings, in this work we conduct an empirical analysis of various post-hoc out-of-distribution (OOD) detection methods for fine-grained food recognition. Our findings indicate that virtual logit matching (ViM) performed the best overall, likely due to its combination of logits and feature-space representations. Additionally, our work reinforces prior notions in the OOD domain, noting that models with higher ID accuracy performed better across the evaluated OOD detection methods. Furthermore, transformer-based architectures consistently outperformed convolution-based models in detecting OOD samples across various methods.",CV,24 Mar 2025
https://doi.org/10.48550/arXiv.2503.18544,Distilling Stereo Networks for Performant and Efficient Leaner Networks,"Rafia Rahim, Samuel Woerz, Andreas Zell","Knowledge distillation has been quite popular in vision for tasks like classification and segmentation however not much work has been done for distilling state-of-the-art stereo matching methods despite their range of applications. One of the reasons for its lack of use in stereo matching networks is due to the inherent complexity of these networks, where a typical network is composed of multiple two- and three-dimensional modules. In this work, we systematically combine the insights from state-of-the-art stereo methods with general knowledge-distillation techniques to develop a joint framework for stereo networks distillation with competitive results and faster inference. Moreover, we show, via a detailed empirical analysis, that distilling knowledge from the stereo network requires careful design of the complete distillation pipeline starting from backbone to the right selection of distillation points and corresponding loss functions. This results in the student networks that are not only leaner and faster but give excellent performance . For instance, our student network while performing better than the performance oriented methods like PSMNet [1], CFNet [2], and LEAStereo [3]) on benchmark SceneFlow dataset, is 8x, 5x, and 8x faster respectively. Furthermore, compared to speed oriented methods having inference time less than 100ms, our student networks perform better than all the tested methods. In addition, our student network also shows better generalization capabilities when tested on unseen datasets like ETH3D and Middlebury.",CV,24 Mar 2025
https://doi.org/10.48550/arXiv.2503.18541,UniPCGC: Towards Practical Point Cloud Geometry Compression via an Efficient Unified Approach,"Kangli Wang, Wei Gao","Learning-based point cloud compression methods have made significant progress in terms of performance. However, these methods still encounter challenges including high complexity, limited compression modes, and a lack of support for variable rate, which restrict the practical application of these methods. In order to promote the development of practical point cloud compression, we propose an efficient unified point cloud geometry compression framework, dubbed as UniPCGC. It is a lightweight framework that supports lossy compression, lossless compression, variable rate and variable complexity. First, we introduce the Uneven 8-Stage Lossless Coder (UELC) in the lossless mode, which allocates more computational complexity to groups with higher coding difficulty, and merges groups with lower coding difficulty. Second, Variable Rate and Complexity Module (VRCM) is achieved in the lossy mode through joint adoption of a rate modulation module and dynamic sparse convolution. Finally, through the dynamic combination of UELC and VRCM, we achieve lossy compression, lossless compression, variable rate and complexity within a unified framework. Compared to the previous state-of-the-art method, our method achieves a compression ratio (CR) gain of 8.1\% on lossless compression, and a Bjontegaard Delta Rate (BD-Rate) gain of 14.02\% on lossy compression, while also supporting variable rate and variable complexity.",CV,24 Mar 2025
https://doi.org/10.48550/arXiv.2503.18540,HiRes-FusedMIM: A High-Resolution RGB-DSM Pre-trained Model for Building-Level Remote Sensing Applications,"Guneet Mutreja, Philipp Schuegraf, Ksenia Bittner","Recent advances in self-supervised learning have led to the development of foundation models that have significantly advanced performance in various computer vision tasks. However, despite their potential, these models often overlook the crucial role of high-resolution digital surface models (DSMs) in understanding urban environments, particularly for building-level analysis, which is essential for applications like digital twins. To address this gap, we introduce HiRes-FusedMIM, a novel pre-trained model specifically designed to leverage the rich information contained within high-resolution RGB and DSM data. HiRes-FusedMIM utilizes a dual-encoder simple masked image modeling (SimMIM) architecture with a multi-objective loss function that combines reconstruction and contrastive objectives, enabling it to learn powerful, joint representations from both modalities. We conducted a comprehensive evaluation of HiRes-FusedMIM on a diverse set of downstream tasks, including classification, semantic segmentation, and instance segmentation. Our results demonstrate that: 1) HiRes-FusedMIM outperforms previous state-of-the-art geospatial methods on several building-related datasets, including WHU Aerial and LoveDA, demonstrating its effectiveness in capturing and leveraging fine-grained building information; 2) Incorporating DSMs during pre-training consistently improves performance compared to using RGB data alone, highlighting the value of elevation information for building-level analysis; 3) The dual-encoder architecture of HiRes-FusedMIM, with separate encoders for RGB and DSM data, significantly outperforms a single-encoder model on the Vaihingen segmentation task, indicating the benefits of learning specialized representations for each modality. To facilitate further research and applications in this direction, we will publicly release the trained model weights.",CV,24 Mar 2025
https://doi.org/10.48550/arXiv.2503.18536,DiN: Diffusion Model for Robust Medical VQA with Semantic Noisy Labels,"Erjian Guo, Zhen Zhao, Zicheng Wang, Tong Chen, Yunyi Liu, Luping Zhou","Medical Visual Question Answering (Med-VQA) systems benefit the interpretation of medical images containing critical clinical information. However, the challenge of noisy labels and limited high-quality datasets remains underexplored. To address this, we establish the first benchmark for noisy labels in Med-VQA by simulating human mislabeling with semantically designed noise types. More importantly, we introduce the DiN framework, which leverages a diffusion model to handle noisy labels in Med-VQA. Unlike the dominant classification-based VQA approaches that directly predict answers, our Answer Diffuser (AD) module employs a coarse-to-fine process, refining answer candidates with a diffusion model for improved accuracy. The Answer Condition Generator (ACG) further enhances this process by generating task-specific conditional information via integrating answer embeddings with fused image-question features. To address label noise, our Noisy Label Refinement(NLR) module introduces a robust loss function and dynamic answer adjustment to further boost the performance of the AD module.",CV,24 Mar 2025
https://doi.org/10.48550/arXiv.2503.18527,AIM2PC: Aerial Image to 3D Building Point Cloud Reconstruction,"Soulaimene Turki, Daniel Panangian, Houda Chaabouni-Chouayakh, Ksenia Bittner","Three-dimensional urban reconstruction of buildings from single-view images has attracted significant attention over the past two decades. However, recent methods primarily focus on rooftops from aerial images, often overlooking essential geometrical details. Additionally, there is a notable lack of datasets containing complete 3D point clouds for entire buildings, along with challenges in obtaining reliable camera pose information for aerial images. This paper addresses these challenges by presenting a novel methodology, AIM2PC , which utilizes our generated dataset that includes complete 3D point clouds and determined camera poses. Our approach takes features from a single aerial image as input and concatenates them with essential additional conditions, such as binary masks and Sobel edge maps, to enable more edge-aware reconstruction. By incorporating a point cloud diffusion model based on Centered denoising Diffusion Probabilistic Models (CDPM), we project these concatenated features onto the partially denoised point cloud using our camera poses at each diffusion step. The proposed method is able to reconstruct the complete 3D building point cloud, including wall information and demonstrates superior performance compared to existing baseline techniques. To allow further comparisons with our methodology the dataset has been made available at this https URL",CV,24 Mar 2025
https://doi.org/10.48550/arXiv.2503.18513,LookCloser: Frequency-aware Radiance Field for Tiny-Detail Scene,"Xiaoyu Zhang, Weihong Pan, Chong Bao, Xiyu Zhang, Xiaojun Xiang, Hanqing Jiang, Hujun Bao","Humans perceive and comprehend their surroundings through information spanning multiple frequencies. In immersive scenes, people naturally scan their environment to grasp its overall structure while examining fine details of objects that capture their attention. However, current NeRF frameworks primarily focus on modeling either high-frequency local views or the broad structure of scenes with low-frequency information, which is limited to balancing both. We introduce FA-NeRF, a novel frequency-aware framework for view synthesis that simultaneously captures the overall scene structure and high-definition details within a single NeRF model. To achieve this, we propose a 3D frequency quantification method that analyzes the scene's frequency distribution, enabling frequency-aware rendering. Our framework incorporates a frequency grid for fast convergence and querying, a frequency-aware feature re-weighting strategy to balance features across different frequency contents. Extensive experiments show that our method significantly outperforms existing approaches in modeling entire scenes while preserving fine details.",CV,24 Mar 2025
https://doi.org/10.48550/arXiv.2503.18512,Uncertainty-guided Perturbation for Image Super-Resolution Diffusion Model,"Leheng Zhang, Weiyi You, Kexuan Shi, Shuhang Gu","Diffusion-based image super-resolution methods have demonstrated significant advantages over GAN-based approaches, particularly in terms of perceptual quality. Building upon a lengthy Markov chain, diffusion-based methods possess remarkable modeling capacity, enabling them to achieve outstanding performance in real-world scenarios. Unlike previous methods that focus on modifying the noise schedule or sampling process to enhance performance, our approach emphasizes the improved utilization of LR information. We find that different regions of the LR image can be viewed as corresponding to different timesteps in a diffusion process, where flat areas are closer to the target HR distribution but edge and texture regions are farther away. In these flat areas, applying a slight noise is more advantageous for the reconstruction. We associate this characteristic with uncertainty and propose to apply uncertainty estimate to guide region-specific noise level control, a technique we refer to as Uncertainty-guided Noise Weighting. Pixels with lower uncertainty (i.e., flat regions) receive reduced noise to preserve more LR information, therefore improving performance. Furthermore, we modify the network architecture of previous methods to develop our Uncertainty-guided Perturbation Super-Resolution (UPSR) model. Extensive experimental results demonstrate that, despite reduced model size and training overhead, the proposed UWSR method outperforms current state-of-the-art methods across various datasets, both quantitatively and qualitatively.",CV,24 Mar 2025
https://doi.org/10.48550/arXiv.2503.18507,Can Text-to-Video Generation help Video-Language Alignment?,"Luca Zanella, Massimiliano Mancini, Willi Menapace, Sergey Tulyakov, Yiming Wang, Elisa Ricci","Recent video-language alignment models are trained on sets of videos, each with an associated positive caption and a negative caption generated by large language models. A problem with this procedure is that negative captions may introduce linguistic biases, i.e., concepts are seen only as negatives and never associated with a video. While a solution would be to collect videos for the negative captions, existing databases lack the fine-grained variations needed to cover all possible negatives. In this work, we study whether synthetic videos can help to overcome this issue. Our preliminary analysis with multiple generators shows that, while promising on some tasks, synthetic videos harm the performance of the model on others. We hypothesize this issue is linked to noise (semantic and visual) in the generated videos and develop a method, SynViTA, that accounts for those. SynViTA dynamically weights the contribution of each synthetic video based on how similar its target caption is w.r.t. the real counterpart. Moreover, a semantic consistency loss makes the model focus on fine-grained differences across captions, rather than differences in video appearance. Experiments show that, on average, SynViTA improves over existing methods on VideoCon test sets and SSv2-Temporal, SSv2-Events, and ATP-Hard benchmarks, being a first promising step for using synthetic videos when learning video-language models.",CV,24 Mar 2025
https://doi.org/10.48550/arXiv.2503.18484,PM4Bench: A Parallel Multilingual Multi-Modal Multi-task Benchmark for Large Vision Language Model,"Junyuan Gao, Jiahe Song, Jiang Wu, Runchuan Zhu, Guanlin Shen, Shasha Wang, Xingjian Wei, Haote Yang, Songyang Zhang, Weijia Li, Bin Wang, Dahua Lin, Lijun Wu, Conghui He","Existing multilingual benchmarks for Large Vision Language Models (LVLMs) suffer from limitations including language-specific content biases, disjointed multimodal input formats, and a lack of safety evaluation. To address these gaps, we propose PM4Bench, the first Parallel Multilingual Multi-Modal Multi-task Benchmark for LVLMs. PM4Bench features a parallel corpus design across 10 languages, enabling fair and accurate cross-lingual comparisons. It includes the vision setting where text and queries are embedded in images, requiring LVLMs to simultaneously ""see"", ""read"", and ""think"", aligning with real-world applications. Additionally, PM\textsuperscript{4}Bench incorporates safety evaluations, addressing critical oversight in existing multilingual benchmarks. Using PM4Bench, we evaluate 11 mainstream LVLMs, revealing significant cross-linguistic performance disparities, particularly in vision settings, and identifying OCR capability as a key determinant of these imbalances. We will release PM4Bench at this https URL .",CV,24 Mar 2025
https://doi.org/10.48550/arXiv.2503.18483,Explaining Domain Shifts in Language: Concept erasing for Interpretable Image Classification,"Zequn Zeng, Yudi Su, Jianqiao Sun, Tiansheng Wen, Hao Zhang, Zhengjue Wang, Bo Chen, Hongwei Liu, Jiawei Ma","Concept-based models can map black-box representations to human-understandable concepts, which makes the decision-making process more transparent and then allows users to understand the reason behind predictions. However, domain-specific concepts often impact the final predictions, which subsequently undermine the model generalization capabilities, and prevent the model from being used in high-stake applications. In this paper, we propose a novel Language-guided Concept-Erasing (LanCE) framework. In particular, we empirically demonstrate that pre-trained vision-language models (VLMs) can approximate distinct visual domain shifts via domain descriptors while prompting large Language Models (LLMs) can easily simulate a wide range of descriptors of unseen visual domains. Then, we introduce a novel plug-in domain descriptor orthogonality (DDO) regularizer to mitigate the impact of these domain-specific concepts on the final predictions. Notably, the DDO regularizer is agnostic to the design of concept-based models and we integrate it into several prevailing models. Through evaluation of domain generalization on four standard benchmarks and three newly introduced benchmarks, we demonstrate that DDO can significantly improve the out-of-distribution (OOD) generalization over the previous state-of-the-art concept-based this http URL code is available at this https URL.",CV,24 Mar 2025
https://doi.org/10.48550/arXiv.2503.18478,Video-XL-Pro: Reconstructive Token Compression for Extremely Long Video Understanding,"Xiangrui Liu, Yan Shu, Zheng Liu, Ao Li, Yang Tian, Bo Zhao","Despite advanced token compression techniques, existing multimodal large language models (MLLMs) still struggle with hour-long video understanding. In this work, we propose Video-XL-Pro, an efficient method for extremely long video understanding, built upon Reconstructive Compression of Tokens (ReCoT), a learnable module that leverages self-supervised learning to generate comprehensive and compact video tokens. ReCoT introduces two key components: (i) Dynamic Token Synthesizer (DTS): DTS generates pseudo-video tokens from static image tokens by learning intra-token relationships, which are then used in masked video modeling. (ii) Semantic-Guided Masking (SGM): SGM adaptively masks redundant visual tokens to facilitate more effective reconstructive learning. To improve training efficiency in MLLMs fine-tuning, we introduce a video-specific dataset pruning strategy and design a simple yet Query-aware Selector that enables the model to precisely locate query-relevant video tokens. With only 3B parameters, Video-XL-Pro outperforms most 7B models trained on larger datasets across multiple long video understanding benchmarks. Moreover, it can process over 8K frames on a single A100 GPU while maintaining high-quality performance.",CV,24 Mar 2025
https://doi.org/10.48550/arXiv.2503.18476,Global-Local Tree Search for Language Guided 3D Scene Generation,"Wei Deng, Mengshi Qi, Huadong Ma","Large Vision-Language Models (VLMs), such as GPT-4, have achieved remarkable success across various fields. However, there are few studies on 3D indoor scene generation with VLMs. This paper considers this task as a planning problem subject to spatial and layout common sense constraints. To solve the problem with a VLM, we propose a new global-local tree search algorithm. Globally, the method places each object sequentially and explores multiple placements during each placement process, where the problem space is represented as a tree. To reduce the depth of the tree, we decompose the scene structure hierarchically, i.e. room level, region level, floor object level, and supported object level. The algorithm independently generates the floor objects in different regions and supported objects placed on different floor objects. Locally, we also decompose the sub-task, the placement of each object, into multiple steps. The algorithm searches the tree of problem space. To leverage the VLM model to produce positions of objects, we discretize the top-down view space as a dense grid and fill each cell with diverse emojis to make to cells distinct. We prompt the VLM with the emoji grid and the VLM produces a reasonable location for the object by describing the position with the name of emojis. The quantitative and qualitative experimental results illustrate our approach generates more plausible 3D scenes than state-of-the-art approaches. Our source code is available at this https URL .",CV,24 Mar 2025
https://doi.org/10.48550/arXiv.2503.18470,MetaSpatial: Reinforcing 3D Spatial Reasoning in VLMs for the Metaverse,"Zhenyu Pan, Han Liu","We present MetaSpatial, the first reinforcement learning (RL)-based framework designed to enhance 3D spatial reasoning in vision-language models (VLMs), enabling real-time 3D scene generation without the need for hard-coded optimizations. MetaSpatial addresses two core challenges: (i) the lack of internalized 3D spatial reasoning in VLMs, which limits their ability to generate realistic layouts, and (ii) the inefficiency of traditional supervised fine-tuning (SFT) for layout generation tasks, as perfect ground truth annotations are unavailable. Our key innovation is a multi-turn RL-based optimization mechanism that integrates physics-aware constraints and rendered image evaluations, ensuring generated 3D layouts are coherent, physically plausible, and aesthetically consistent. Methodologically, MetaSpatial introduces an adaptive, iterative reasoning process, where the VLM refines spatial arrangements over multiple turns by analyzing rendered outputs, improving scene coherence progressively. Empirical evaluations demonstrate that MetaSpatial significantly enhances the spatial consistency and formatting stability of various scale models. Post-training, object placements are more realistic, aligned, and functionally coherent, validating the effectiveness of RL for 3D spatial reasoning in metaverse, AR/VR, digital twins, and game development applications. Our code, data, and training pipeline are publicly available at this https URL.",CV,24 Mar 2025
https://doi.org/10.48550/arXiv.2503.18469,CFReID: Continual Few-shot Person Re-Identification,"Hao Ni, Lianli Gao, Pengpeng Zeng, Heng Tao Shen, Jingkuan Song","Real-world surveillance systems are dynamically evolving, requiring a person Re-identification model to continuously handle newly incoming data from various domains. To cope with these dynamics, Lifelong ReID (LReID) has been proposed to learn and accumulate knowledge across multiple domains incrementally. However, LReID models need to be trained on large-scale labeled data for each unseen domain, which are typically inaccessible due to privacy and cost concerns. In this paper, we propose a new paradigm called Continual Few-shot ReID (CFReID), which requires models to be incrementally trained using few-shot data and tested on all seen domains. Under few-shot conditions, CFREID faces two core challenges: 1) learning knowledge from few-shot data of unseen domain, and 2) avoiding catastrophic forgetting of seen domains. To tackle these two challenges, we propose a Stable Distribution Alignment (SDA) framework from feature distribution perspective. Specifically, our SDA is composed of two modules, i.e., Meta Distribution Alignment (MDA) and Prototype-based Few-shot Adaptation (PFA). To support the study of CFReID, we establish an evaluation benchmark for CFReID on five publicly available ReID datasets. Extensive experiments demonstrate that our SDA can enhance the few-shot learning and anti-forgetting capabilities under few-shot conditions. Notably, our approach, using only 5\% of the data, i.e., 32 IDs, significantly outperforms LReID's state-of-the-art performance, which requires 700 to 1,000 IDs.",CV,24 Mar 2025
https://doi.org/10.48550/arXiv.2503.18463,"SIT-FER: Integration of Semantic-, Instance-, Text-level Information for Semi-supervised Facial Expression Recognition","Sixian Ding, Xu Jiang, Zhongjing Du, Jiaqi Cui, Xinyi Zeng, Yan Wang","Semi-supervised deep facial expression recognition (SS-DFER) has gained increasingly research interest due to the difficulty in accessing sufficient labeled data in practical settings. However, existing SS-DFER methods mainly utilize generated semantic-level pseudo-labels for supervised learning, the unreliability of which compromises their performance and undermines the practical utility. In this paper, we propose a novel SS-DFER framework that simultaneously incorporates semantic, instance, and text-level information to generate high-quality pseudo-labels. Specifically, for the unlabeled data, considering the comprehensive knowledge within the textual descriptions and instance representations, we respectively calculate the similarities between the facial vision features and the corresponding textual and instance features to obtain the probabilities at the text- and instance-level. Combining with the semantic-level probability, these three-level probabilities are elaborately aggregated to gain the final pseudo-labels. Furthermore, to enhance the utilization of one-hot labels for the labeled data, we also incorporate text embeddings excavated from textual descriptions to co-supervise model training, enabling facial visual features to exhibit semantic correlations in the text space. Experiments on three datasets demonstrate that our method significantly outperforms current state-of-the-art SS-DFER methods and even exceeds fully supervised baselines. The code will be available at this https URL.",CV,24 Mar 2025
